{
  "schema_version": 1,
  "agent_id": "agent.1",
  "base_sha256": "4f53cda18c2baa0c0354bb5f9a3ecbe5ed12ab4d8e11ba873c2f11161202b945",
  "sha256": "4f53cda18c2baa0c0354bb5f9a3ecbe5ed12ab4d8e11ba873c2f11161202b945",
  "replace": false,
  "scanned_at_unix_ms": 1790000000000,
  "started": [],
  "changed": [],
  "ended": [],
  "transient": [
    {
      "finding": {
        "schema_version": 1,
        "finding_id": "finding.7a2",
        "scan_id": "scan.2026-09-28.2",
        "rule_set_id": "baseline",
        "rule_id": "port.vnc.exposed",
        "rule_version": 1,
        "observed_at_unix_ms": 1790000000000,
        "severity": "high",
        "confidence": 100,
        "message": "VNC is reachable from the network",
        "evidence": [
          "listening.exposed_ports"
        ]
      },
      "ended_at_unix_ms": 1790003600000
    }
  ],
  "transient_dropped": 3
}
